{
  "data": [
    {
      "id_distribuicao_recurso_proposta": 43389,
      "id_proposta": 30854,
      "in_tipo_distribuicao": "Emenda",
      "in_tipo_gnd": "GND3",
      "nr_emenda_proposta": "2025.5041.0002",
      "nm_parlamentar_proposta": "COMISSÃO DA SAÚDE",
      "in_tipo_emenda_parlamentar_proposta": "Comissão",
      "valor_emenda": 5000000.0
    }
  ],
  "total_pages": 1,
  "total_items": 1,
  "page_number": 1,
  "page_size": 1
}
